{"fields_header":["ลำดับที่","รายการ","WBS","วงเงินงบประมาณปัจจุบัน","รวมจ่ายจริงถึงสิ้นปีก่อนหน้า","รวมจ่ายจริงปีปัจจุบัน","รวมจ่ายจริง","เงินล่วงหน้าปีก่อนหน้า","เงินประกันปีก่อนหน้า","เงินล่วงหน้าปีปัจจุบัน","เงินประกันปีปัจจุบัน","เงินล่วงหน้าคงเหลือ","เงินประกันค้างจ่าย","รวมจ่ายทั้งสิ้นปีก่อนหน้า","รวมจ่ายทั้งสิ้นปีปัจจุบัน","รวมจ่ายทั้งสิ้น","งบประมาณหักรวมจ่ายทั้งสิ้น","PO หักรวมจ่ายจริง PO","งบประมาณหักรวมจ่ายจริง","IR-คงเหลือ","GR-คงเหลือ","PO-คงเหลือ","PR-คงเหลือ","วงเงินคงเหลือยังไม่ดำเนินการ","สถานะ","วันที่สร้าง"],"HTTP_post":{"sub_row_data_count":"","table_nameeeeeeeee":"งาน0901344","fields_count":"[\"ลำดับที่\",\"รายการ\",\"WBS\",\"วงเงินงบประมาณปัจจุบัน\",\"รวมจ่ายจริงถึงสิ้นปีก่อนหน้า\",\"รวมจ่ายจริงปีปัจจุบัน\",\"รวมจ่ายจริง\",\"เงินล่วงหน้าปีก่อนหน้า\",\"เงินประกันปีก่อนหน้า\",\"เงินล่วงหน้าปีปัจจุบัน\",\"เงินประกันปีปัจจุบัน\",\"เงินล่วงหน้าคงเหลือ\",\"เงินประกันค้างจ่าย\",\"รวมจ่ายทั้งสิ้นปีก่อนหน้า\",\"รวมจ่ายทั้งสิ้นปีปัจจุบัน\",\"รวมจ่ายทั้งสิ้น\",\"งบประมาณหักรวมจ่ายทั้งสิ้น\",\"PO หักรวมจ่ายจริง PO\",\"งบประมาณหักรวมจ่ายจริง\",\"IR-คงเหลือ\",\"GR-คงเหลือ\",\"PO-คงเหลือ\",\"PR-คงเหลือ\",\"วงเงินคงเหลือยังไม่ดำเนินการ\",\"สถานะ\",\"วันที่สร้าง\"]","webdatarocks_setting":"","sql_select":"SELECT  table_name_id , h1 , h2 , h3 , h4 , h5 , h6 , h7 , h7 FROM `test_add_log` WHERE 1=1","condition_type_row":["main_con","main_con"],"main_oplist":["","AND"],"main_fieldlist":["รายการ","รายการ"],"main_condition_opv":["=","="],"main_condition_value_input":["2","3"],"main_condition_value_type":["con_value","con_value"],"row_id":["14","44","86","15","52","64","79"]},"webdatarocks_setting":{"dataSource":{"dataSourceType":"json","data":"getJSONData('SELECT  table_name_id , h1 , h2_1 , h2_2 , h3 , h4 , h5 , h6 , h7 , h8 , h9 , h10 , h11 , h12 , h13 , h14 , h15 , h16 , h17 , h18 , h19 , h20 , h21 , h22 , h23 , h24 , h25 , h26 FROM `งาน0901344` WHERE ((h2_1 IN( 2, 3))) AND table_name_id IN ( 14 , 44 , 86 , 15 , 52 , 64 , 79)','ลำดับที่,รายการ,WBS,วงเงินงบประมาณปัจจุบัน,รวมจ่ายจริงถึงสิ้นปีก่อนหน้า,รวมจ่ายจริงปีปัจจุบัน,รวมจ่ายจริง,เงินล่วงหน้าปีก่อนหน้า,เงินประกันปีก่อนหน้า,เงินล่วงหน้าปีปัจจุบัน,เงินประกันปีปัจจุบัน,เงินล่วงหน้าคงเหลือ,เงินประกันค้างจ่าย,รวมจ่ายทั้งสิ้นปีก่อนหน้า,รวมจ่ายทั้งสิ้นปีปัจจุบัน,รวมจ่ายทั้งสิ้น,งบประมาณหักรวมจ่ายทั้งสิ้น,PO หักรวมจ่ายจริง PO,งบประมาณหักรวมจ่ายจริง,IR-คงเหลือ,GR-คงเหลือ,PO-คงเหลือ,PR-คงเหลือ,วงเงินคงเหลือยังไม่ดำเนินการ,สถานะ,วันที่สร้าง')"},"slice":{"rows":[{"uniqueName":"ลำดับที่"},{"uniqueName":"รายการ"},{"uniqueName":"สถานะ"}],"columns":[{"uniqueName":"Measures"}],"measures":[{"uniqueName":"primary_key","aggregation":"count"}],"expands":{"expandAll":"true"},"drills":{"drillAll":"true"}},"options":{"drillThrough":"false"}}}